,Job Title,company,Location,Employment Type,level,requirement,description,Experience Needed,skills
15,Senior IOT Engineer,Noases,"Nasr City, Cairo",Full Time,Experienced (Non-Manager),"['Experience in embedded system firmware and software development.', 'Good knowledge of IoT sensors and gateways, electronic product design, hardware testing, and troubleshooting.', 'Experience with IoT standards and communication protocols like MQTT, HTTPs, CoAP, etc.', 'Familiarity with M2M protocols like Modbus and client-server protocols like HTTP (REST/JSON) and Kafka.', 'Familiarity with industrial monitoring and control systems like SCADA, PLC, DCS, etc.', 'Understand the principles of TCP/IP and the Network Connection Principle of the Internet.', 'Familiar with various LAN networking.', 'Experience with communications channels such as WiFi, Zigbee, BLE, NB-IoT, Sigfox, LoRaWAN, etc.', 'Knowledge of communication protocols (I2C, SPI, UART, or other protocols) for system interface, programming, and debugging.', 'Familiar with wiring and interfacing protocols such as RS232, RS485, Ethernet, etc.', 'Experience in development boards, e.g., Arduino, Raspberry Pi, Edison, NodeMCU, etc.', 'Experience with MySQL and SQL knowledge is a plus', 'Knowledge of reading component data sheets and schematics.', 'Firm understanding of IoT architecture and principles.', 'Familiarity with big data and machine learning algorithms.', 'Strong analytical and reasoning skills.']","['Analyzing and understanding business and customer requirements for industrial IoT solutions.', 'Researching and shortlisting different IoT sensors and gateways for a target IoT solution.', 'Studying data sheets of different IoT sensors and gateways from different vendors and comparing them based on technology, certification, logistics, support, cost, and other constraints.', 'Interfacing different industrial IoT sensors with the company’s IoT platform.', 'Embedded C/Python/Node-RED programming for project development.', 'Designing platform solutions that are cloud-compatible and work with IoT applications', 'Sensor integration and firmware testing, debugging, documentation, and troubleshooting.', 'Ensure certifications and other regulatory compliance as per project requirements.', 'Work independently or in a group and take up project responsibilities.', 'Effectively communicate issues and request resolution from the IoT Solutions Team / CTO.']",3 To 5 Years,"['Information Technology (IT)', 'Software Development', 'MySQL', 'SQL', 'Software', 'Engineering']"
16,Administrative Assistant,Tecnogroup,"Nasr City, Cairo",Full Time,Entry Level (Junior Level / Fresh Grad),"['Bachelor degree.', '0-2 years experience', 'Extremely proficient with Microsoft Office Suite or similar software with the ability to learn new or updated software.', 'Excellent command of English', 'Working knowledge of office equipment, like printers and fax machines.', 'Excellent time management skills and the ability to prioritize work.', 'Attention to detail and problem-solving skills.', 'Strong organizational skills with the ability to multi-task.', 'Excellent organizational and leadership skills.', 'Outstanding communication and interpersonal abilities']","['Coordinating office activities and operations to secure efficiency and compliance to company policies.', 'Handle all kinds of incoming correspondence and manage to distribute them internally.', 'Follow up all correspondence in case specific action shall take place (this includes phone queries both local and international, mails, e-mails, letters, faxes and all kinds of forms).', 'Closely follow up the deadlines for all correspondence.', 'Prepare communications, such as memos, emails, reports and other correspondence.', 'Create and maintain filing systems, both electronic and physical.', 'Work collaboratively with other departments to help solve clerical issues.', 'Conduct research, analysis as directed by department manager.', 'Submit timely reports and prepare presentations/proposals as assigned.', 'Create and update records and databases.', 'Assist colleagues whenever necessary.']",1 To 2 Years,"['Administration', 'Fresh Graduates', 'Communication', 'Admin', 'Microsoft Office', 'Time Management']"
17,Operational Excellence,Al Andalous Pharmaceutical Industries,"6th of October, Giza",Full Time,Experienced (Non-Manager),"[""Bachelor's Degree in any Relevant field."", 'Experience from 7:10 years & At Least 3 years in the same position.', 'Lean Certificate Holder is required.', 'Pharmaceutical or Manufacturing Experience is preferred.', '6th October and nearby residents are preferred.']","['Configuring manufacturing systems to reduce cost, improve efficiency and develop best practice within the production processes.', 'Defining and implementing process improvements on key initiatives that result in significant improvements in service delivery, increasing organizational effectiveness.', 'Provide leadership and direction to cross-functional teams empowered to execute the Lean Six Sigma Methodologies to processes capability improvement, productivity improvement and cost reduction.', 'Study machines stoppage causes during operation to decrease the frequency of machines break down.', 'Report on daily base waste figures per each material including reporting updates based on targets & operational KPIs.', 'Evaluate and monitoring all machinery and production lines performance using OEE calculation.', 'Deploy the Learning Modules of LEAN & Six Sigma across the designated site.', 'Demonstrate the knowledge of Lean & Six Sigma methodologies, principles and tools incorporated into daily work..', 'Direct and participate in organizational needs assessment, development of program plans, goals and objectives regarding LEAN & Six Sigma methodologies implementation.', 'Direct evaluation, update and revisions of project plans to meet project deadlines.', 'Managing Kaizen activities and coaching the team on Visual Boards, and other tools', 'Monitor and report progress of projects through established metrics for each project. .', 'Participate in budgeting and fiscal management of the LEAN & Six Sigma Projects.', 'Provide regular feedback orally or in writing to Leadership.', 'Participate as a member of the site leadership team and advise on LEAN & Six Sigma projects']",7 To 10 Years,"['LEAN', 'Manufacturing', 'Operations', 'Pharmaceutical', 'Computer Skills', 'Microsoft Excel']"
18,Mechanical Design Engineer,Mina Co. for Engineering,"Abu Rawash, Giza",Full Time,Experienced (Non-Manager),"[""Bachelor's degree in Mechatronics engineering, Mechanical engineering, or Industrial production engineering"", 'Good user of AutoCAD (2D), Cutting Optimizer, and Solidworks (sheet metal & configuration and equation).', 'Good command of the English and Arabic languages.', 'Ability to work under pressure', 'Good Microsoft Office', 'Creativity', 'Excellent problem-solving and analytical skills.', 'Experience in leadership and supervising a team is optional.']","['Designing and Modeling: The primary responsibility is to create 3D models and designs using SolidWorks software, specifically for sheet metal components and assemblies. This includes designing sheet metal and Aluminium profile assembly using variable equations in Solidworks and other sheet metal structures.', 'Sheet Metal Specific Features: Proficiency in utilizing SolidWorks Sheet Metal tools and features is crucial. The engineer must be able to create and modify sheet metal parts with features like bends, flanges, tabs, gussets, louvers, ribs, and other sheet metal-specific details.', 'Drafting and Documentation: Generating detailed engineering drawings, including views, dimensions, tolerances, and other necessary information, is essential. The engineer must create accurate documentation that complies with industry standards and can be used for manufacturing.', 'A basic understanding of AutoCAD', 'Research and analyze customer specifications and other data to evaluate the feasibility, cost, and maintenance requirements of designs or applications.', 'Making full workshop drawings of all Mina Co. products.', 'Reverse engineering of new products and machine spare parts.', 'Continuous Learning: Staying up to date with the latest SolidWorks features, industry trends, and advancements in sheet metal design and manufacturing processes. Actively seeking professional development opportunities to enhance skills and knowledge.', 'Research & Development.', 'Innovation of new ideas.']",2 To 5 Years,"['Design', 'Mechanical Engineering', 'AutoCAD', 'Engineering', 'SolidWorks', 'Mechanical', 'English', 'Manufacturing Industry', 'Industrial Engineering', 'Industrial Design', 'Steel Industry', 'HVAC Engineering', 'Heating, Ventilation, and Air Conditioning', 'Mechatronics', 'CNC']"
19,Python Developer,Integrated Technology Group,"Heliopolis, Cairo",Full Time,Experienced (Non-Manager),"['Proven experience from 2 to 4 years as a Python Developer.', 'Proven experience in AI and machine learning algorithms.', 'Proven experience in libraries such as Scikit-Learn, TensorFlow, and PyTorch is a must.', 'Knowledge in ChatGPT API integration. This would involve utilizing the ChatGPT APIs.', 'Strong proficiency in Python programming language, with a deep understanding of object-oriented programming principles and design patterns.', 'Experience with popular Python frameworks.', 'Experience working in an Agile development environment, with the ability to collaborate with team members and deliver high-quality code within set deadlines.', 'Excellent problem-solving skills and a proactive approach to tackling complex coding challenges.', 'Strong Research skills.']","['Write effective, scalable code', 'Develop back-end components to improve responsiveness and overall performance', 'Integrate user-facing elements into applications', 'Test and debug programs', 'Improve functionality of existing systems', 'Implement security and data protection solutions', 'Assess and prioritize feature requests', 'Coordinate with internal teams to understand user requirements and provide technical solutions']",2 To 4 Years,"['ML', 'Python', 'TensorFlow', 'PyTorch']"
20,Senior Data Analyst,Cilantro,"Maadi, Cairo",Full Time,Experienced (Non-Manager),[],[],4 To 6 Years,"['Analysis', 'analytical', 'Computer Science', 'Data Analysis', 'Data Analyst', 'Data', 'Programming', 'Python', 'SQL']"
21,Kibana Dashboard Developer,DXC.technology,"Cairo, Egypt",Full Time,Not Specified,[],"['Create visually appealing and user-friendly dashboards using Kibana.', 'Transform raw data into meaningful insights by designing intuitive panels and visualizations.', 'Collaborate with stakeholders to understand their data needs and translate them into effective dashboard solutions.', 'Hands-on experience with the Elastic Stack (Elasticsearch, Logstash, Kibana).', 'Configure and optimize Elasticsearch indices for efficient data retrieval.', 'Ensure seamless integration of Kibana with data sources.', 'Utilize Kibana to create dynamic and informative dashboards.', 'Implement filters, time series visualizations, and geospatial displays.', 'Leverage Kibana’s features such as Canvas and Data Views.', 'Familiarity with Elasticsearch data models and search capabilities.', 'Optimize queries and aggregations for performance.', 'Proficiency in writing KQL queries to extract relevant data.', 'Ability to create custom visualizations using KQL.', 'Awareness of anomaly detection using machine learning in Kibana.', 'Ability to incorporate anomaly swim lanes and charts.', 'Bachelor’s degree in Computer Science, Information Technology, or related field.', 'Experienced in Kibana dashboard design and development.', 'Strong understanding of data visualization principles.', 'Excellent communication skills and ability to collaborate with cross-functional teams.', 'Familiarity with Grafana is a plus.']",Not Specified,"['information technology (it)', 'computer science', 'sql', 'marketing', 'social media', 'media', 'communication skills', 'design', 'recruitment', 'business', 'writing', 'communication']"
22,Senior Cloud Engineer - LLM & GenAI,Antal International,Egypt,Full Time,Not Specified,[],"['Degree in Computer Science, Software Engineering, Information Technology, or a related field. ', 'At least 5 years of experience in the development and maintenance of AWS-based cloud environments designed to host Data, Analytics, and AI applications.', 'Experience with Azure AI service is a plus. ', 'Proficiency in infrastructure as a code (e.g., Terraform, CloudFormation) and other serverless services such as Lambda, API Gateway, CloudWatch, etc. ', 'Experience with good API development practices, RESTful services, web sockets, and container orchestration services such as Kubernetes or AWS ECS. ', 'Experienced with version control (git), automated testing, continuous integration, and deployment (Continuous Deployment for Machine Learning / CD4ML is a plus).   ', 'Familiar with enterprise security aspects such as SSL, TLS, HTTPS, LDAP, Active Directory, Oauth, JWT, and bearer authentication. ', 'Good understanding of AWS networking and infrastructure (e.g., VPC, load balancer, subnets, security groups). ', 'Hands-on experience with architectural design, architectural prototyping, and testing (test case definition and test verification). ']",Not Specified,"['Engineering', 'Information Technology (IT)', 'Computer Science', 'Software Engineering', 'Software Development', 'Computer Engineering', 'Mechanical Engineering', 'Electrical Engineering', 'Quality Control', 'Civil Engineering', 'Quality Assurance', 'Software Testing', 'Sales', 'AutoCAD', 'SQL', 'Construction', 'Architecture', 'Sales Skills', 'Testing', 'Software']"
23,Data Scientist,Aman,"6th of October, Giza",Full Time,Entry Level (Junior Level / Fresh Grad),"['Ownership ', 'Functional Skills', 'Ideas presentation and Taking initiative ', 'Continuous Learning ', 'Customer Centricity', 'Solid knowledge of data analyzing tools such as Power BI', 'Excellent presentation skills', 'Excellent knowledge of data types and metrics', '0-1 years of proven experience as a Data Analyst or Data Scientist', 'Bachelor’s degree in Business Administration, Finance, or a related field']","['Identifying and collecting data from different sources and departments to analyze it and come up with a suitable model to support the business.', 'Identify relevant data sources and sets to mine for stakeholder’s business needs, and collect large structured and unstructured datasets and variables to come up with needed analysis ', 'Use different data analysis tools to present results in a clear manner such as Tableau and PowerBI to create dashboards that supports Aman management in the decision-making process ', 'Build predictive models and machine-learning algorithms', 'Working closely with stakeholders and managers to establish briefs for data-related projects across Aman', 'Keeping an eye on data trends and market trends and suggest any needed corrective actions to the management ']",0 To 1 Year,"['Analyst', 'Data Analyst', 'Data Science']"
24,Administrative Assistant,Tomooh Educational Consultation,"New Cairo, Cairo",Full Time,Entry Level (Junior Level / Fresh Grad),[],[],1 To 3 Years,"['Child Development', 'Child Care', 'Administration', 'Administration Affairs', 'HR Admin']"
25,Data Analyst,Aman,"6th of October, Giza",Full Time,Entry Level (Junior Level / Fresh Grad),"['Ownership ', 'Functional Skills', 'Ideas presentation and Taking initiative ', 'Continuous Learning ', 'Customer Centricity', 'Proficiency with data mining, mathematics, and statistical analysis', 'Experience with Excel, PowerPoint, Tableau, SQL, and programming languages (ex: Java/Python, SAS)', '1-2 years of proven experience as a Data Analyst or Data Scientist', 'Bachelor’s degree in Statistics, Applied Mathematics, or a related discipline']","['Execute numerical data to help solve problems across various domains and All Aman LOBs', 'Research and devise innovative statistical models for data analysis', 'Analyze data for trends and patterns, and interpret data with clear objectives in mind', 'Identify relevant data sources and sets to mine for client business needs, and collect large structured and unstructured datasets and variables', 'Devise and utilize algorithms and models to mine big-data stores; perform data and error analysis to improve models; clean and validate data for uniformity and accuracy', 'Implement analytical models in production by collaborating with software developers and machine-learning engineers', 'Enable smarter business processes by using analytics for meaningful insights', 'Collaborate with product design and engineering teams to develop an understanding of needs', 'Research and devise innovative statistical models for data analysis']",1 To 2 Years,"['Analysis', 'Analyst', 'Data', 'Data Analyst', 'Data Analysis', 'Statistics', 'Python', 'Tableau', 'SQL']"
26,Secretary,falconmisr,"Wadi Alnatrun, Beheira",Full Time,Entry Level (Junior Level / Fresh Grad),[''],"['Active participation in office management, including handling general clerical tasks', 'Organize and prepare meeting schedules for various departments', 'Ensure meeting spaces are properly requisitioned ahead of schedule', 'Manage office equipment and supplies, and ordering new equipment and supplies as needed', 'Work collaboratively with other departments to help solve clerical and coordination issues', 'Offer assistance to accounting department to provide manage invoices, payments, and receipts', 'Confer with human resources department to provide assistance with personnel databases and other duties', 'Attend with department managers or other senior-level officers in meetings, including taking notes and recordings as needed', 'A degree in office administration or a related field may be preferred', '1-2 years of experience in same field', 'Excellent knowledge of Microsoft Office Suite, including Word, PowerPoint, and Excel', 'Experience using business email services, such as Microsoft Outlook', 'Previous experience with, or an ability to learn to use common office equipment, such as modern phone systems, fax machines, and copy machines', 'Comfort multitasking and handling multiple requests from different individuals and departments', 'Ability to work quickly and in a potentially high-stress environment', 'Strong communication skills and extremely self-motivated when managing communication channels', 'Highly organized and capable of creating organizational systems that others easily utilize']",1 To 3 Years,"['Administration', 'Microsoft Office', 'Office management', 'Secretary']"
27,Data Scientist,Confidential Company,"Maadi, Cairo",Freelance / Project,Experienced (Non-Manager),"['Proven experience as a Data Scientist or Data Analyst', 'Experience in data mining', 'Understanding of machine-learning and operations research', 'Knowledge of R, SQL and Python; familiarity with Scala, Java or C++ is an asset', 'Experience using business intelligence tools (e.g. Tableau) and data frameworks (e.g. Hadoop)', 'Analytical mind and business acumen', 'Strong math skills (e.g. statistics, algebra)', 'Problem-solving aptitude', 'Excellent communication and presentation skills', 'BSc/BA in Computer Science, Engineering or relevant field; graduate degree in Data Science or other quantitative field is preferred']","['Identify valuable data sources and automate collection processes', 'Undertake preprocessing of structured and unstructured data', 'Analyze large amounts of information to discover trends and patterns', 'Build predictive models and machine-learning algorithms', 'Combine models through ensemble modeling', 'Present information using data visualization techniques', 'Propose solutions and strategies to business challenges', 'Collaborate with engineering and product development teams']",2 To 3 Years,"['Computer Science', 'Data', 'Data Science', 'data scientist', 'Information Technology (IT)', 'scientist']"
28,Senior Front-End Development Engineer,Pixelogic Media Partners LLC,"Cairo, Egypt",Full Time,Not Specified,[],[],Not Specified,"['Information Technology (IT)', 'Computer Science', 'Software Development', 'javaScript', 'CSS', 'HTML', 'HTML5', 'Software Engineering', 'Angular', 'CSS3', 'Web Development', 'Engineering', 'jQuery', 'Front-End', 'Computer Engineering', 'Front End', 'Git', 'UI', 'React', 'SASS']"
29,Production Internship,Prometeon Tyres Group – Egypt (Ex,Pirelli Tyres Egypt),Internship,Entry Level (Junior Level / Fresh Grad),"['Graduates of Production “OR” Industrial Engineer Alexandria University “OR” Arab Academy for Science and Technology.', 'Graduate of 2021 & 2022 & 2023 ONLY.', 'Males with Military service defined.', 'Alexandria Residence only.', 'Good to Excellent English commands.', 'Perfect Ms. Office commands.', 'Good knowledge about SQL language. ', 'Ability to work under pressure and meet deadlines with a flexible schedule.', 'Good communication and presentation skills.', 'Ability to deal with different ages and mindsets.', 'Familiar with industrial engineering processes and applications.', 'the ability to lead a team or to be a part of a team.', 'the ability to manage people from different cultures & to help them through their problems.', ' Knowledge of production and processes:\n• Just-in-time (JIT)\n• Lean\n• 5S\n• Total Quality Management (TQM)\n• Visual aids\n• Work standards all in a continuous improvement ""Kaizen-mode""\n ']","['Planning & following up on daily production processes to get maximum productivity with good quality with respect to safety aspects.', 'Improving production process to get max productivity of the machinery & workers.', 'Analyzing daily, and monthly production data machines OEE.', 'The ability to work on department & machine layout.', 'Exposure to the tire manufacturing process & the Mechanical Role', 'Develop strong communication, teamwork, and problem-solving skills', 'An inside view of the work environment.', 'An actual on-the-job training that will help secure better career opportunities in the future.', 'Internship monthly Bonus.', 'Restaurant Meal.', 'Transportation provided to the factory (from the nearest meeting point).', 'Certificate by the end of the program.', 'Social Insurance.']",0 To 1 Year,"['Science', 'Production']"
30,Palantir Foundry Cloud Tech Lead,Antal International,Egypt,Full Time,Not Specified,[],"['B.Sc. (or higher) Degree in Computer Science, Software Engineering, Statistics, Mathematics, or a related field.', 'Hands-on software development experience, strong track record focusing on software delivery with profound experience building cloud-native systems.', 'Technical leadership experience leading & tutoring engineering teams to deliver complex software and services.', 'Extensive skills in ETL design and development using Python, PySpark or Java.  ', 'Experience in cloud technologies and services required from ingesting, storing, and manipulating data to building advanced analytics, in-depth experience and ideally relevant certification with services with AWS, Palantir Foundry or Azure (Architect, Networking, Security, SysOps).', 'Establish software engineering best practices incl. DevOps/MLOps, working cross-functionally.', 'Proficiency and experience with infrastructure as code, good API design practices, Linux containers, and containerized applications.', 'Understanding of the concepts of various fields of software engineering, such as web frontends and backends, SQL and NoSQL databases, continuous integration and continuous deployment, as well as system security and identity management.', 'Experience with version control (git), automated testing, continuous integration, and deployment (also including Continuous Deployment for Machine Learning / CD4ML).', 'Experience in a regulated environment is a plus (GxP).']",Not Specified,"['information technology (it)', 'computer science', 'aws', 'docker', 'python', 'software development', 'software engineering', 'linux', 'java', 'devops', 'software', 'azure']"
31,Data Analyst,2CooM,"6th of October, Giza",Full Time,Experienced (Non-Manager),"[""Bachelor's degree in a quantitative field such as mathematics, statistics, computer science, or a related discipline. "", 'Proven experience as a data analyst or similar role.', ' Proficiency in data manipulation and analysis tools such as SQL, Python, R, or similar.', ' Strong analytical skills with the ability to work with complex datasets.', ' Experience with data visualization tools such as Tableau, Power BI, or similar.', ' Familiarity with statistical analysis techniques, predictive modeling, and machine learning algorithms. ', 'Excellent problem-solving skills and attention to detail. ', 'Strong written and verbal communication skills.', ' Ability to work independently and collaborate effectively in a team environment.']",[],1 To 5 Years,"['Analyst', 'Computer Science', 'Data Analyst', 'Python', 'SQL']"
